url,prodi,kata_kunci,judul,abstrak
http://jurusan.tik.pnj.ac.id/newrepositori/v2/dok/620,TMD,"augmented reality, technology, environmental, islamic art museum, exhibits",a development of ar/interactive display method and environmental graphic at islamic art museum using augmented reality,"augmented reality (ar) is a technology that can combine the real world with the virtual world in 3d and interactive form in real time. museums of islamic art are usually curated in such a way that visitors are not comfortable with the layout and environment within the space. the aim of this research is to enhance the experience with the development of augmented reality (ar) in the galleries of the museum of islamic art. the target audience of this questionnaire is both local and foreign tourists who visit the islamic art museum with the aim of enhancing their experience while in the exhibition in a different way. this paper uses the analysis, design, development, implementation, and evaluation (addie) model it provides a proven method for designing clear and effective training programs. the findings of this research will contribute to the development of augmented reality (ar), which will offer environmental graphics in islamic art museums, ultimately enhancing the overall visitor experience. as a result, this project provides with augmented reality technology, visitors can visit the exhibition virtually using only smartphones and instagram/facebook platforms. this study shows how the application helps to enhance the visitor experience in visiting the islamic art museum exhibition"
http://jurusan.tik.pnj.ac.id/newrepositori/v2/dok/624,TMD,"game edukasi, huruf jepang, kanji jepang",pembuatan game open world sebagai media edukasi huruf kanji jepang menggunakan unity,"bahasa merupakan alat untuk melakukan interaksi berupa bunyi yang keluar dari mulut. berbeda dengan bahasa indonesia yang menggunakan alfabet, bahasa jepang memiliki tiga jenis huruf, yaitu: hiragana, katakana, dan kanji. karena huruf pada kanji jepang sangat banyak dan berbeda dengan yang biasa dilihat oleh orang-orang yang tinggal di luar jepang setiap hari, belum lagi adanya perbedaan cara membaca onyomi & kunyomi. sebagian orang mengalami kesulitan untuk menghafal dan membaca seluruh huruf kanji jepang, seperti yang terjadi di sma sejahtera 1 depok. oleh karena itu perlu adanya solusi metode pembelajaran yang lebih efektif serta menarik. game edukasi dapat dijadikan media pembelajaran yang menarik, karena menyatukan belajar dengan bermain. perancangan game edukasi ini menggunakan metode game development life cycle (gdlc). penelitian ini menggunakan pendekatan mix-method yang menggabungkan pendekatan kualitatif dan kuantitatif. hasil dari penelitian ini adalah game edukasi untuk platform android dan komputer. hasil beta testing pretest posttest terdapat kenaikan pada nilai rata - rata responden dari yang sebelumnya 6,9 pada pretest menjadi 8,8 pada posttest."
http://jurusan.tik.pnj.ac.id/newrepositori/v2/dok/626,TMD,"awareness campaign, dental health, illustration book, augmented reality",designing of the creative illustration book as learning media about dental health for children,"poor dental health is a significant public health concern, particularly among children. caring our dental health is a must to do for better health for adulthood later. studies in malaysia found most common cases for children is tooth decay or cavities. however, published learning media for children about dental health still limited and outdated. therefore, there is a need for new approach to make a learning media about dental health for children that are effective and engaging. this research project aims to fill this gap by designing an illustration book for children and understanding children dental health and provide the solution through the book. data were collected using quantitative method from sub-urban city in malaysia and indonesia, specifically on klang valley and jakarta. it was found that illustration book about dental health for children still hard to find in sub-urban area. the teaching process about dental health to children is often do by parents because it was found the children often brush their teeth twice a day. parents stated they will often use illustration book about dental health to teach their children if the book is available on the market. the result implies a presence of illustration book about dental health will help parents on helping them teaching their children. this study conclude children can learn something new with a fun and creative way."
http://jurusan.tik.pnj.ac.id/repositori/dok/15,TI,"berita, classification, long short term memory, prediction",rancang bangun sistem klasifikasi konten berita menggunakan algoritma long short-term memory (lstm),"kementerian komunikasi dan informatika (kominfo) adalah salah satu kemetrian yang bergerak di bidang komunikasi dan informatika. kominfo memiliki tugas untuk mengawasi konten-konten yang beredar di sosial media maupun berita. dengan terus bertambahnya jumlah berita yang beredar, pihak media dihadapkan dengan berbagai permasalahan. salah satunya adalah proses pengolahan berita yang masih dilakukan manual dengan cara membaca isi berita satu persatu. untuk itu diperlukan sistem yang mampu menangani masalah di atas. sistem yang dibagun harus mampu memberikan prediksi berita yang relevan. prediksi tersebut diperoleh dari proses pengumpulan dan data dari berbagai situs berita. data tersebut kemudian diproses oleh model long short term memory (lstm). long short term memory biasa digunakan untuk menangani kasus prediksi maupun klasifikasi dalam berbagai bidang. model lstm tersebut diimplementasikan ke dalam aplikasi web-based untuk menenetukan kelas dari konten berita. berdasarkan hasil pengujian yang dilakukan, model lstm yang dibuat memiliki tingkat akurasi sebesar 86%. dengan demikian implementasi lstm mampu menjadi suatu solusi dalam mengatasi masalah yang ada."
http://jurusan.tik.pnj.ac.id/repositori/dok/17,TI,"maturitas, risk management, iso:”31000”, sistem pengukuran maturitas",rancang bangun aplikasi tingkat kematangan risk management pt jasa marga (persero) tbk berbasis website,"risk management dapat didefinisikan sebagai “metode pendekatan untuk menyelesasikan suatu masalah yaitu ancaman murni (pure threats). risk ini dikaitkan dengan melakukan pengaturan pada ketidapastian yang berfungsi untuk mendapatkan tujuan yang telah ditetapkan, pengukuran ini biasa dinamakan dengan ‘risk management’. pengukuran maturitas risk management sesuai iso: 31000 terdapat 5 level maturitas yaitu: initial, repeatable, defined, managed, intergrated. untuk menentukan tingkat level maturitas risk management yang berbasis website. berdasarkan hasil penenetuan tingkat level maturitas yang dilakukan oleh konsultan terdapat 96 responden yaitu 14 risk owner dan risk acessor dari divisi kantor pusat, 22 risk owner dan risk acessor dari anak perusahaan, 1 risk owner dan risk acessor dari kantor regional, 9 risk owner dan risk acessor dari kantor cabang. berdasarkan hasil pengukuran tingkat maturitas oleh konsultan, didapatkan hasil 3.5 dengan tingkat level yaitu define."
http://jurusan.tik.pnj.ac.id/repositori/dok/19,TI,"clustering, data mining, emosi, k-means, visualisasi data",pembuatan visualisasi data emosi dengan metode clustering menggunakan algoritma k-means berbasis website,"emosi merupakan aspek yang dapat mempengaruhi pengambilan keputusan seseorang dalam melakukan aktifitas sehari-hari. menurut daniel goleman penulis buku “emotional intelligence” bahwa 80% keberhasilan seseorang dipengaruhi oleh kecerdasan emosi (eq). oleh karna itu, emosi negatif berpotensi merusak pemikiran serta rencana dalam mewujudkan sebuah impian seseorang. aplikasi emo health membantu peran psikolog dalam melakukan pengenalan dan manajemen emosi pengguna. namun data emosi pengguna pada aplikasi belum sepenuhnya dapat dilihat secara jelas dan efisien oleh psikolog karna belum adanya grafik informasi seperti tabel atau grafik. visualisasi data pengguna pada aplikasi sangat diperlukan untuk menentukan tindakan psikolog terhadap relevansi visual yang diberikan. selain visualisasi data, teknik data mining diperlukan untuk membaca karakteristik dan mendapatkan pengetahuan baru dari data yang diberikan. data mining berfokus kepada jumlah data emosi negatif per usia dan status pekerjaan serta emosi negatif seperti sedih, marah dan takut sebagai data yang akan digali pengetahuannya. dalam pengelompokan data emosi negatif pada aplikasi ini menggunakan metode clustering k-means untuk mendapatkan pengetahuan berdasarkan kesamaan nilai data. berdasarkan evaluasi kluster menggunakan dbi (davies bouldin index) maka didapatkan jumlah 6 kluster sudah optimal dengan nilai 0,312. hasil dari pengelompokan di visualisasikan menggunakan diagram batang, scatterplot dan donut chart."
http://jurusan.tik.pnj.ac.id/repositori/dok/20,TI,"android, certainty factor, emosi, sistem pakar",pembuatan sistem pakar untuk mengenali emosi menggunakan metode certainty factor berbasis android,"emosi merupakan perasaan intens seseorang yang mendorongnya untuk melakukan suatu tindakan yang dapat dipicu dari dalam atau luar dirinya. rirn (rencana induk riset nasional) menyatakan bahwa indonesia saat ini menghadapi berbagai tantangan kuat dibidang kesehatan masyarakat yaitu penyehatan jiwa, seperti kesehatan emosional yang berakibat penyimpangan berlaku. minimnya keterbatasan ruang dan waktu ketika harus berkonsultasi dengan seorang psikolog menyebabkan kendala bagi setiap orang untuk memahami dan mengenali emosinya yang akan berakibat buruk bagi pengambilan keputusan. untuk mengatasi masalah ini, dalam penelitian ini dibangun aplikasi sistem pakar untuk mengenali emosi menggunakan metode certainty factor berbasis android. proses perhitungan menggunakan nilai kepercayaan dan basis pengetahuan yang diberikan oleh seorang pakar. metode cf memiliki kinerja sistem yang dapat berjalan sesuai dengan persyaratan fungsional dan menghasilkan persentase akurasi yang tinggi. berdasarkan hasil pengujian, sistem pakar mengenali emosi menggunakan metode certainty factor telah bekerja dengan baik dengan tingkat akurasi sebesar 92,31% dari data uji sebanyak 26 kasus."
http://jurusan.tik.pnj.ac.id/repositori/dok/21,TI,"ahp, jenis tindakan, pelanggaran lalu lintas, sistem pendukung keputusan",sistem pendukung keputusan penentuan lokasi untuk tindakan represif menggunakan metode analytic hiearchy process dan visualisasi peta di wilayah depok,"jumlah pelanggaran lalu lintas yang terjadi di wilayah depok dari tahun 2017 sampai 2019 mengalami fluktuasi, angka pelanggaran lalu lintas berdasarkan jenis kelamin menunjukkan kenaikan tiap tahunnya untuk jenis kelamin wanita sebesar 13% sedangkan jenis kelamin laki-laki mengalami kenaikan pada tahun 2018 sebesar 16% dan mengalami penurunan pada tahun 2019 sebesar 12%. untuk meningkatkan kesadaran masyarakat dan mentertibkan lalu lintas di suatu daerah, pihak kepolisian memiliki tiga jenis tindakan yaitu, patroli, sosialisasi dan razia. dalam menentukan antara ketiga jenis tindakan tersebut memerlukan suatu sistem pendukung keputusan agar dimungkinkan akurat dalam aspek prioritas jenis tindakan yang diambil. metode yang digunakan dalam sistem pendukung keputusan adalah analytics hierarchy process (ahp) dengan tiga kriteria yaitu umur dibawah 17 tahun, umur diatas 17 tahun dan jumlah kecelakaan. agar mudah dipahami pengguna maka hasil per-rankingan akan ditampilkan dalam bentuk heatmap dengan semakin jelas warna pada suatu titik maka titik tersebut memiliki weight yang besar dan menjadi rekomendasi untuk diadakan razia. jika semakin pudar maka menjadi rekomendasi diantara sosialisasi dan patroli."
http://jurusan.tik.pnj.ac.id/repositori/dok/28,TI,"keterampilan, pelatihan, perempuan, text mining, web scraping",implementasi teknologi text mining dan web scraping untuk mengumpulkan informasi pada website pelatihan keterampilan khusus perempuan,"mencari informasi melalui internet sangatlah mudah, dengan waktu yang relatif singkat bisa mendapatkan berbagai macam informasi yang diinginkan. banyaknya sumber informasi yang ada dan beragam akan menyebabkan timbulnya information overload. information overload adalah kondisi dimana seseorang sulit dalam menerima, memahami, dan mengolah informasi dikarenakan sumber informasi yang berlebih. information overload salah satunya terjadi pada informasi mengenai pelatihan keterampilan perempuan yang dibutuhkan untuk meningkatkan kualitas diri. dengan banyaknya laman web yang menyajikan informasi mengenai pelatihan keterampilan, tidaklah mudah untuk perempuan dapat mendapatkan informasi yang diinginkan karena harus mengakses sebanyak mungkin laman web guna mendapatkan informasi yang cocok. penelitian ini bertujuan untuk membuat sistem pengumpulan informasi mengenai pelatihan keterampilan khusus perempuan dengan mengimplementasikan teknologi text mining dan web scraping dan menggabungkannya ke dalam satu laman informasi sehingga mempermudah kaum perempuan dalam mendapatkan informasi mengenai pelatihan keterampilan. dari eksperimen yang sudah dilakukan, text mining dan web scraping berhasil diimplementasikan, dengan adanya laman web yang mengintegrasikan informasi dari laman-laman web yang lain, perempuan mendapatkan informasi mengenai pelatihan keterampilan pada satu sumber informasi."
http://jurusan.tik.pnj.ac.id/repositori/dok/29,TI,"black-box testing, laravel, prototype, seleksi penerimaan mahasiswa baru, sistem pendukung keputusan, weighted product (wp)",sistem penunjang keputusan seleksi penerimaan mahasiswa baru berdasarkan nilai rapor menggunakan metode weighted product,"politeknik negeri jakarta (pnj) melakukan seleksi penerimaan mahasiswa baru setiap tahunnya. seleksi penerimaan ini diharapkan dapat mendapatkan mahasiswa yang berprestasi akademik tinggi dan diprediksi berhasil menyelesaikan studi dengan tepat waktu. seleksi penerimaan mahasiswa baru dilakukan dengan dua cara yaitu ujian tulis dan menggunakan nilai rapor. seleksi penerimaan mahasiswa baru dengan menggunakan nilai rapor siswa dari semester satu sampai semester lima. dalam melakukan proses seleksi penerimaan mahasiswa baru, pnj masih masih dilakukan secara manual sehingga cenderung memakan waktu yang lama. maka dari itu, dibuatlah sistem pendukung keputusan untuk membantu menyeleksi mahasiswa baru. dalam penelitian ini, dilakukan seleksi penerimaan mahasiswa baru menggunakan metode weighted product. metode pengembangan sistem yang digunakan adalah metode prototype. sistem dibangun dengan framework laravel serta postgresql sebagai database. dilakukan dua pengujian, yaitu pengujian fungsional sistem dan pengujian perbandingan antara hasil perhitungan metode weighted product pada sistem dan perhitungan pada excel. pengujian fungsional sistem menggunakan teknik black-box testing dengan pendekatan alpha testing."
http://jurusan.tik.pnj.ac.id/repositori/dok/30,TI,"black-box testing, laravel, prototype, seleksi penerimaan mahasiswa baru, sistem pendukung keputusan, simple additive weighting (saw)",sistem penunjang keputusan seleksi penerimaan mahasiswa baru berdasarkan nilai rapor menggunakan metode simple additive weighting method,"setiap tahunnya politeknik negeri jakarta (pnj) melakukan seleksi penerimaan mahasiswa baru. seleksi penerimaan ini diharapkan dapat mendapatkan mahasiswa yang berprestasi akademik tinggi dan diprediksi berhasil menyelesaikan studi dengan tepat waktu. seleksi penerimaan mahasiswa baru dilakukan dengan dua cara yaitu ujian tulis dan menggunakan nilai rapor. seleksi penerimaan mahasiswa baru dengan menggunakan nilai rapor siswa dari semester satu sampai semester lima. dalam melakukan proses seleksi penerimaan mahasiswa baru, pnj masih melakukannya secara manual sehingga cenderung memakan waktu yang lama. maka dari itu, dibuatlah sistem pendukung keputusan untuk membantu menyeleksi mahasiswa baru. dalam penelitian ini, dilakukan seleksi penerimaan mahasiswa baru menggunakan metode simple additive weigthing. metode pengembangan sistem yang digunakan adalah metode prototype. sistem dibangun dengan framework laravel serta postgresql sebagai database. dilakukan dua pengujian, yaitu pengujian fungsional sistem dan pengujian akurasi hasil perhitungan metode simple additive weighting pada sistem. pengujian fungsional sistem menggunakan teknik black-box testing dengan pendekatan alpha testing."
http://jurusan.tik.pnj.ac.id/repositori/dok/35,TI,"optical character recognition (ocr),tesseract, surat keterangan, kelurahan",rancang bangun aplikasi pengajuan surat keterangan warga dengan optical character recognition berbasis android mobile,"kelurahan cipinang cempedak merupakan salah satu unsur pemerintah dan termasuk ke dalam perangkat daerah yang berperan sebagai penyedia layanan untuk masyarakat dilingkungannya. salah satu jenis pelayanan yang ada pada kelurahan cipinang cempedak yaitu pembuatan surat keterangan. surat keterangan merupakan salah satu jenis surat yang dikelurkan oleh kelurahan dan memiliki keterkaitan dengan surat pengantar rt dan rw sebagai persyaratan untuk pembuatannya. dalam proses pembuatanya, masyarakat masih harus menempuh serangkaian proses manual yang mengakibatkan efisiensi waktu berkurang. pada sisi rt/rw juga ditemukan beberapa kekurangan seperti pencatatan dan pendataan pembuatan surat pengantar yang masih dilakukan di buku tulis. penerapan aplikasi pengajuan surat keterangan masyarakat pada rangkaian proses pembuatan surat keterangan di kelurahan, tentu akan meningkatkan efisiensi waktu, biaya dan tenaga. aplikasi ini dapat melakukan distribusi persetujuan surat secara otomatis di setiap rangkaian prosesnya. pengajuan buat surat keterangan dan pengumpulan berkas persyaratannya dapat dilakukan secara online oleh masyarakat. pihak rt, rw dan kelurahan dapat melakukan pemeriksaan dan proses persetujuan permohonan dari masyarakat secara online. aplikasi ini mengimplementasikan optical character recognition (ocr) berbasiskan tesseract untuk mempersingkat proses pengisian biodata dan pelampiran berkas-berkas dari masyarakat yang dibutuhkan untuk pembuatan surat keterangan. fitur ini memiliki tingkat keakuratan sekitar 77 – 98.5%. semua fitur yang ada pada aplikasi ini dapat meningkatkan kualitas pelayanan kelurahan untuk masyarakatnya khusunya di bidang persuratan."
http://jurusan.tik.pnj.ac.id/repositori/dok/36,TI,"levenshtein distance, edit distance, persuratan",sistem deteksi kesalahan ejaan katadalam penulisan surat menggunakan algoritmalevenshtein distance,"sebagian besar aktifitas yang dilakukan dalam kelurahan cipinang cempedak yaitu melakukan persuratan, baik persuratan internal, eksternal maupun pengurusan surat penghantar direktorat jendral kependudukan dan pencatatan sipil (dukcapil). kesalahan penulisan dan control pengecekan bahasa yang baik dan benar dalam pembuatan surat masih dilakukan secara manual, dengan kondisi seperti ini akan menghabiskan banyak waktu. di era teknologi yang kian maju seperti sekarang ini. kesalahan yang pada umumnya disebabkan kedekatan letak keyboard, slip jari, ataupun karena dua karakter yang letaknya tertukar, sehingga ketika pengguna membuat surat, isi dari surat tersebut tidak sesuai. penelitian ini bertujuan mendeteksi kesalahan ejaan kata dalam pembuatan surat yang berpacu dengan kbbi (kamus besar bahasa indonesia) menggunakan algoritma levenshtein distance. total kata yang digunakan dalam penelitian ini sebanyak 43337. ketika terjadi kesalahan kata algoritma ini langsung mencocokan kata tersebut kedalam query dengan konsep insertion, substitution, dan deletion untuk mendapatkan nilai edit yang sama, nilai edit yang dihasilkan berpengaruh terhadap nilai threshold yang ditentukan. hasil penelitian menunjukan bahwa semakin kecil nilai threshold yang diberikan menghasilkan rata rata recall sebesar 91.11% dan semakin besar nilai threshold yang diberikan menghasilkan rata rata recall 77.75%."
http://jurusan.tik.pnj.ac.id/repositori/dok/38,TI,"android, kompensasi, mahasiswa,jtik pnj.",rancang bangun aplikasi e-kompen berbasis android,"penelitian ini membahas tentang pengembangan aplikasi e-kompen jurusan teknik informatika dan komputer pnj (jtik pnj) yang memiliki permasalah kompensasi tiap tahun nya seperti mahasiswa yang ingin melakukan kompensasi diharuskan mengambil kertas, mengisi kompen sendiri dan meminta verifikasi kepada pengawas yang mengamati jalan nya kompensasi mahasiswa,agar mahasiswa dapat point sehingga dapat melunasi kompensasi mereka dari kasus keterlambatan perkuliahan yang meraka buat. aplikasi berbasisi android ini dibuat agar mempermudah mahasiswa dalam mengambil pekerjaan kompensasi yang mereka jalani dan bisa di akses melalui smartphone.mahasiswa akan memiliki akun, akun mahasiswa adalah berupa id dengan nim yang telah didaftarkan oleh admin dan password yang di daftarkan oleh mahasiswa yang bersangkutan melalui smartphone android mereka."
http://jurusan.tik.pnj.ac.id/repositori/dok/40,TI,"android, haversine, simple additive weighting, sistem informasi manajemen les privat",rekomendasi guru terbaik dan terdekat menggunakan algoritma harvesine dan metode simple additive weighting pada modul siswa,"pencarian guru privat masih dilakukan secara manual, sehingga terkadang adanya kendala untuk menemukan guru sesuai dengan kriteria yang diinginkan murid. absensi siswa untuk siswa yang rutin mengikuti les private juga masih dilakukan secara manual dengan murid dan siswa menandatangani absen tersebut setiap melakukan les private dan pembayaran dihitung dari absen yang sudah diisi. penelitian ini untuk mengimplementasikan algoritma haversine dan metode simple adaptive weighting untuk merekomendasi murid yang ingin mencari guru privat terdekat dan sesuai dengan kriteria yang diinginkan. selain itu, terdapat juga absen online menggunakan teknologi barcode dalam aplikasi easy private. aplikasi easy private juga dapat memberikan saran guru dengan jarak terdekat sesuai dengan kebutuhan murid,. berdasarkan pengujian algoritma haversine mendekati nilai 100% dan nilai akurasi metode saw untuk pengujian kasus 1 menghasilkan akurasi sebesar 87.5%, pengujian kasus 2 sebesar 100% dan pengujian kasus 3 sebesar 100%. perbedaan tingkat akurasi tersebut dikarenakan perbedaan bobot kriteria. pengembangan penelitian selanjutnya dapat dilakukan dengan memperhatikan hambatan jarak dan arah perjalan untuk menghitung jarak yang lebih akurat. selain itu, dalam rangka peningkatan aplikasi easy private berdasarkan hasil user acceptance test, sebaiknya diadakan pelatihan untuk mengoperasikan sistem agar pengguna tidak mengalami kendala"
http://jurusan.tik.pnj.ac.id/repositori/dok/50,TI,"black box testing, java, metode profile matching, spring boot, postgresql, website",implementasi metode profile matching pada rancang bangun sistem aplikasi pencarian bengkel mobil berbasis website,"di kota besar seperti dki jakarta, mobil merupakan salah satu pilihan utama transportasi pribadi yang diminati masyarakat. semakin banyaknya pengguna kendaraan mobil di dki jakarta maka semakin banyak pula kendaraan yang memerlukan pemeliharaan dan perbaikan. oleh karena itu, berdasarkan masalah tersebut, perlu dirancang sebuah sistem aplikasi pencarian bengkel mobil terdekat berbasis website sesuai dengan masalah yang dialami pengendara yang dapat menyediakan layanan servis ditempat untuk pengendara mobil serta mengimplementasikan sistem pendukung keputusan dalam proses seleksi pendaftaran bengkel. metode sistem pendukung keputusan yang digunakan adalah metode profile matching. metode ini diimplementasikan untuk proses pendaftaran bengkel pada sistem aplikasi pencarian bengkel mobil berbasis website. aplikasi ini juga dirancang agar mitra bengkel dapat menerima order servis dan melihat detail order servis pengendara mobil. aplikasi ini dibangun menggunakan bahasa pemograman java dengan framework spring boot dan database postgresql. teknik pengujian yang digunakan dalam penelitian ini adalah black box testing dan white box testing. hasil black box testing menunjukkan bahwa semua fitur dalam aplikasi pencarian bengkel terdekat berbasis website dapat berjalan sesuai rencana dengan keberhasilan sistem sebesar 100%. serta, pengujian metode profile matching dalam sistem berjalan sesuai rencana dengan keberhasilan sebesar 100%."
http://jurusan.tik.pnj.ac.id/repositori/dok/51,TI,"alpha testing, android, haversine formula, postgresql, react native",implementasi haversine formula pada rancang bangun sistem aplikasi pencarian bengkel mobil berbasis android,"banyak pengguna mobil yang mengalami kendala dalam perjalanan berupa kecelakaan atau mengalami kerusakan mendadak seperti ban mobil bocor, ban mobil kempes, dan kampas rem mobil habis. pada kondisi darurat tersebut, maka pengguna mobil akan mencari bengkel terdekat dengan posisi pengguna. namun, terkadang sulit ditemukan bengkel terdekat yang sesuai dengan kendala yang dialami. berdasarkan permasalahan tersebut maka dibangun aplikasi pencarian bengkel mobil terdekat berbasis android dengan mengimplementasikan metode haversine formula. dengan aplikasi ini pengendara dapat mencari bengkel mobil terdekat berdasarkan jarak dan kendala mobil. selain itu, pengendara juga dapat memesan servis ditempat dan montir dari bengkel akan mendatangi lokasi pengendara. aplikasi ini dibangun menggunakan framework react native dengan basis data postgresql. dalam pengujiannya, aplikasi ini menggunakan alpha testing dan hasil pengujian 100%. berdasarkan analisis jarak haversine yang dilakukan, perhitungan dengan haversine formula lebih tepat dan akurat jika membandingkannya dengan google maps yang mengukur jarak antara dua titik, karena haversine formula tidak memperhitungkan rute perjalanan, tetapi memperhitungkan jarak berdasarkan panjang garis lurus antara dua titik tanpa mengabaikan kelengkungan bumi."
