url,prodi,kata_kunci,judul,abstrak
http://jurusan.tik.pnj.ac.id/newrepositori/v2/dok/657,TI,"sistem pemesanan, chatbot, coffee shop, dss.",rancang bangun sistem pemesanan menu sigma coffee dengan chatbot berbasis website,"abstrak di era digitalisasi, maraknya penggunaan gadget dimasyarakat bahkan saat melakukan aktivitas kesehariannya. terutama sampai sekarang sudah ada fitur pemesanan makanan dan minuman via online, pemberian rating untuk menu pada restoran via online, dan sebagainya. tetapi sampai saat ini sangat jarang ditemui sistem pemesanan menu dengan pendukung fitur rekomendasi menu chatbot pada sebuah coffee shop. dengan menggabungkan kedua fitur yang telah disebutkan oleh penulis memberikan improvisasi dan inovasi baru untuk sebuah coffee shop, serta ditambahkan fitur ini jelas akan meningkatkan ke efektifan dalam melakukan pembelian serta penggunaan gadget sangat berguna pada saat di coffee shop ataupun restoran. beberapa alesan pun tak hanya itu saja, ada alasan lain yaitu mengurangi keramaian yang berlebih di depan meja kasir yang membuat area tersebut menjadi tidak kondusif dan mencegahnya bersentuhan badan pada saat mengantri agar menghindari hal-hal yang tidak diinginkan terjadi seperti tertularnya penyakit, pelecahan yang dialami dipublik, dan sebagainya. oleh karena itu, dengan dibuatnya sistem pemesanan dengan pendukung chatbot berbasis website pada sigma coffee, selain memberikan keefektifan. terbuatnya website ini juga memberikan kenyamanan bagi pelanggan serta pelayanan yang unik. metode dan bahasa yang digunakan pada perancangan sistem pemesanan dengan chatbot berbasis website pada sigma coffee ini dengan dss metode forward chaining, dan pada tahapan penelitian menggunakan metode prototype, dan pemograman menggunakan bahasa php dengan framework laravel, bahasa python dengan framework fastapi, serta menggunakan mysql basis data dalam pengelolaan data chatbot berbasis website sigma coffee. sangat jarang coffee shop menggunakan fitur yang telah dirancang oleh penulis. sedangkan dengan adanya fitur ini memberikan pelayanan yang efektif dalam melakukan pemesanan pada sebuah coffee shop."
http://jurusan.tik.pnj.ac.id/newrepositori/v2/dok/660,TI,teknik informatika,pembuatan aplikasi “bayar yuk” menggunakan biometric security ganda pengganti pin dan pembuatan website point of sale pada kasir,"dalam mendukung moderenisasi dalam kegiatan transaksi jual beli, dibutuhkan aplikasi atau platform yang dapat diakses dimana saja agar menciptakan mobilitas dalam penggunaannya. sistem pembayaran berbasis teknologi kini telah menggeser sistem transaksi tunai. transaksi menggunakan payment gateway dinilai menguntungkan karena dapat mengurangi biaya transaksi bisnis dan dapat memperbaiki kualitas pelayanan kepada pelanggan. tujuan penelitian ini ialah merancang sistem berbasis mobile dan web yang dapat membantu pedagang dan pembeli di food court griya depok asri dalam bertransaksi, khususnya dalam sisi pembayaran, dan membatu pengguna aplikasi dalam mengamankan data pribadi, yakni pin atau kata sandi saat menggunakan aplikasi. dengan menggunakan flutter, asp.net, dan database mongodb. serta digunakannya biometric security diharapkan dapat mempermudah dan lebih memperaman dalam bertransaksi jual beli, khususnya pembayaran. pembahasan dalam penelitian ini adalah perancangan sistem aplikasi yang dapat membantu penjual dan pembeli dalam bertransaksi dengan menggantikan transaksi dengan menggunakan uang tunai atau cash dengan menggunakan uang elektronik atau cashless. selain itu, aplikasi ini dibuat dengan menggunakan biometric security untuk menggantikan pin atau kata sandi. aplikasi mobile dibuat dengan menggunakan flutter dan website dibuat dengan menggunakan asp.net. setelah melakukan tahapan penelitian sesuai dengan rancangan, sistem diimplementasikan dan dilakukan pengujian dengan metode uji blackbox testing dan uat. kata kunci: biometric security, payment gateway, android, website"
http://jurusan.tik.pnj.ac.id/newrepositori/v2/dok/662,TI,"kirkpatrick, sistem evaluasi, pengembangan",pengembangan sistem evaluasi pelatihan menggunakan model kirkpatrick,"sistem evaluasi pelatihan menggunakan model kirkpatrick adalah aplikasi yang dirancang untuk membantu organisasi mengevaluasi efektivitas pelatihan mereka berdasarkan model kirkpatrick, yang terkenal dengan empat tingkatan evaluasi."
http://jurusan.tik.pnj.ac.id/newrepositori/v2/dok/797,TI,"sistem pakar, penyakit, web, mysql, codeigniter, forward chaining",rancang bangun sistem pakar diagnosa penyakit umum berbasis web menggunakan metode forward chaining (studi kasus: poliklinik politeknik negeri jakarta),"setiap orang pasti akan mengalami sakit, penyakit yang diderita setiap orang berbeda-beda. sakit merupakan suatu kondisi dimana tubuh tidak berada pada kondisi normal yang disebabkan oleh beberapa faktor baik dari dalam maupun dari luar tubuh. maka dari itu kesehatan sangatlah penting bagi setiap orang dalam menjalani aktivitas sehari-hari. dalam dunia kesehatan, teknologi informasi berkembang sangat pesat sehingga menghasilkan sistem-sistem yang dapat membantu dan memfasilitasi para tenaga kesehatan atau ahli dalam menjalankan tugas mereka. salah satu dari sistem tersebut adalah sistem pakar. sistem pakar adalah sistem informasi yang berisi pengetahuan dari pakar sehingga dapat digunakan untuk konsultasi. pengetahuan dari pakar di dalam sistem ini digunakan sebagai dasar oleh sistem pakar untuk menjawab pertanyaan (konsultasi). sistem ini bertujuan untuk mengidentifikasi penyakit umum melalui gejala yang dialami user. adapun contoh penyakit yang akan dianalisa oleh sistem diantaranya: demam berdarah, malaria, influenza, sakit kepala, dan lain sebagainya. manfaat dari sistem ini yaitu user dengan lebih mudah dan cepat mengidentifikasi penyakit melalui gejala-gejala yang dialami oleh user tersebut. maka dari itu jika user (terutama warga politeknik negeri jakarta) mengalami gejala-gejala aneh bisa langsung menggunakan aplikasi ini agar mengetahui penyakit apa yang dialaminya tanpa mengunjungi poliklinik secara langsung."
http://jurusan.tik.pnj.ac.id/newrepositori/v2/dok/799,TI,"website, laravel, point of sales, umkm",sistem informasi point of sale untuk toko berbasis website menggunakan framework laravel,"pertumbuhan usaha mikro kecil dan menengah (umkm) yang diatur didalam perundang-undangan nomor 20 tahun 2008, memiliki kontribusi terbanyak dalam perkembangan perekonomian di indonesia yaitu sebanyak 99,62% dari total usaha yang ada pada tahun 2021 khususnya pada bagian sektor bisnis ritel, terutama dalam perdagangan grosiran dan eceran. tak sedikit yang menjalankan bisnisnya masih dalam bentuk komersial atau secara tradisional yang mana hal tersebut memiliki resiko terjadi kesalahan dalam pengoperasian bisnis dan dapat merugikan bisnis. untuk menyelesaikan permasalahan tersebut, maka bisnis ritel dituntut untuk bisa beradaptasi dengan perkembangan teknologi informatika yang pesat untuk memastikan keberlangsungan bisnisnya. solusi yang bisa dilakukan adalah dengan mengimplemenkan sistem informasi point of sale (pos) berbasis website. sistem ini dirancang untuk membantu pemilik bisnis dalam memanajemen penjualan, pembelian, pemantauan inventaris sacara real-time dan pelaporan transaksi. pembuatan sistem informasi ini dikembangkan menggunakan framework laravel dan menggunakan database mysql dengan metode pengembangan yang dilakukan adalah metode prototype. pengujian dilakukan menggunakan metode black box testing untuk memastikan sistem tidak ada error atau bug dan berjalan sebagaimana mestinya. diharapkan dengan implementasi sistem informasi pos ini dapat memudahkan pemilik usaha menjalankan operasional bisnisnya."
http://jurusan.tik.pnj.ac.id/newrepositori/v2/dok/21,TMJ,"safetynet, custom rom, android, resurrection remix os, rooting",analisis kerentanan sistem keamanan safetynet attestation pada custom rom resurrection remix 8.6.5 di redmi note 8,"resurrection remix os (rros) merupakan official custom rom yang populer dengan fitur yang paling banyak tersedia, juga memiliki kinerja yang stabil, serta masa pakai baterai yang baik. namun, rros khusunya di perangkat redmi note 8 terdapat masalah pada safetynet attestation dan berdampak kepada aplikasi yang menggunakan api safetynet attestation tidak bisa dijalankan. celah keamanan ini dapat dimanfaatkan dengan membuat module patch yang bernama safetynet-pass agar dapat mengelabui aplikasi yang menggunakan safetynet api bisa berjalan dengan normal layaknya di sistem operasi default. untuk melalukan penelitian ini, perangkat dalam keadaan unlock bootloader, terpasang custom recovery dan diperlukan akses root untuk memodifikasi sistem, konfigurasi pada magisk dan module patch safetynet-pass. magisk berperan sebagai root manager untuk melakukan flashing modul dan menyembunyikan status rooted pada aplikasi yang terpilih. untuk mengaktifkan magisk diperlukan flashing menggunakan custom recovery. setelah itu, dibuat module patch safetynet-pass dan flashing menggunakan magisk app. hasil yang didapat dari penelitian ini adalah mengubah status safetynet attestation dari “failed” menjadi “passed” (cts profile yang “false” menjadi “true”). mengubah status safetynet attestation yang “failed” menjadi “passed” dapat mengelabui aplikasi yang menggunakan safetynet api, yakni bisa berjalan dengan normal layaknya di sistem operasi default."
http://jurusan.tik.pnj.ac.id/newrepositori/v2/dok/25,TMJ,aes; basis data; enkripsi; keamanan database; mysql.,optimalisasi rancang bangun keamanan dalam pengamanan basis data menggunakan algoritma aes pada aplikasi sistem informasi akademik smk harapan bangsa dengan framework laravel,"basis data merupakan wadah untuk menyimpan data asset penting dan perlu dilindungi. kerahasiaan dan juga keamanan data yang tersimpan pada basis data merupakan salah satu hal penting dari suatu sistem informasi sebuah instansi agar terhindar dari berbagai kerugian. hal tersebut dapat diatasi oleh penerapan kriptografi untuk mengamankan data dengan metode enkripsi. enkripsi merupakan suatu metode yang digunakan untuk mengubah bentuk data dari yang sebelumnya dapat dipahami hingga tidak dapat dipahami. enkripsi juga dapat digunakan untuk menjaga serta mengamankan kerahasiaan data dari upaya peretasan. dengan demikian, dibutuhkan jenis enkripsi yang dapat menjaga kerahasiaan serta keamanan data pada sistem informasi tersebut. maka, dengan menggunakan enkripsi aes 256 yang diharapkan dapat menambah keamanan pada data sehingga terjaga kerahasiaanya."
http://jurusan.tik.pnj.ac.id/newrepositori/v2/dok/26,TMJ,bots; captcha; web,optimalisasi rancang bangun keamanan sistem informasi dalam keamanan validasi pada laman login website sistem akademik smk harapan bangsa menggunakan captcha,"pada zaman modern ini, perkembangan teknologi informasi sangatlah pesat. perkembangan ini dapat dilihat dengan semakin berkembang pesatnya fitur-fitur yang terdapat dalam tekhnologi digital, terutama teknologi komputer berbasis web. dengan adanya teknologi ini, memungkinkan pengoperasiannya serba otomatis dan canggih, dengan sistem komputerisasi atau format yang dapat dibaca oleh komputer. namun berbagai persoalan pada sisi lain timbul dalam penerapan teknologi digital yang digunakan tersebut, salah satu masalah adalah kemungkinan terjadinya kejahatan. salah satu bentuk kejahatan yang dilakukan adalah dengan menggunakan robot program (bots) yang menyamar sebagai manusia. oleh karena itu diperlukan metode pengujian yang sering disebut reverse turing test untuk membedakan proses validasi antara robot dan manusia. completely automated public turing test to tell computers and humans apart (captcha) merupakan salah satu metode reverse turing test yang dapat mencegah terjadinya serangan bots. dengan demikian implementasi captcha yang diguanakan dapat mencegah terjadinya serangan dan dapat meningkatkan keamanan pada web."
http://jurusan.tik.pnj.ac.id/newrepositori/v2/dok/27,TMJ,keamanan informasi; keamanan website; laravel; penetration testing; scanning vulnerability; sql injection; sql map; xss.,optimalisasi rancang bangun keamanan sistem informasi dalam keamanan website sistem akademik terhubung dengan e-learning pada smk harapan bangsa dari serangan sql injection dan cross site scripting,"dengan mengandalkan internet, instansi pendidikan seperti pada smk harapan bangsa menggunakan dan membutuhkan sistem informasi akademik terhubung dengan e-learning berbasis website yang dapat meningkatkan efisiensi dan efektifitas dalam penggunaannya. sehingga diperlukannya sistem yang terjaga keamanan nya karena keamanan bertujuan untuk menciptakan rasa aman bagi manusia salah satunya keamanan di dunia teknologi. kejahatan di dunia teknologi dan informasi terutama pada aplikasi website sangat sering terjadi contohnya kejahatan berupa serangan sql injection yaitu merupakan ancaman dengan memasukan code sql berbahaya untuk mengambil database website serta melakukan bypass verifikasi akun pada website, dan juga kejahatan berupa cross site scripting yaitu merupakan ancaman menginputkan code javascript berbahaya pada kolom dinamis website sehingga script yang dimasukan oleh penyerang akan terus berjalan setiap halaman yang terinjeksi dipanggil. adanya kesalahan penulisan kode program dalam pembuatan website dimanfaatkan oleh penyerang dengan melakukan penyerangan sql injection dan cross site scripting. oleh sebab itu, maka dilakukannya optimalisasi rancang bangun keamanan sistem informasi dalam keamanan website sistem akademik terhubung dengan e-learning pada smk harapan bangsa untuk melakukan pencegahan dari serangan sql injection dan cross site scripting (xss) dan menutup celah keamanannya."
http://jurusan.tik.pnj.ac.id/newrepositori/v2/dok/32,TMJ,"modsecurity, reverse proxy, ddos attack, web server, jaringan",skripsi implementasi serta analisa modsecurity dan reverse proxy untuk pencegahan ddos attack pada web server,"di indonesia sendiri website sudah digunakan untuk berbagai macam kebutuhan. dengan jumlah penduduk indonesia sebanyak 270 juta jiwa lebih tak heran penggunaan website dapat berjalan optimal dan banyak sekali pemanfaatannya. namun, sayangnya banyaknya pengguna website di indonesia berbanding lurus dengan ancaman sebuah perangkat terkena serangan ddos. dengan memanfaatkan modsecurity sebagai web application firewall (waf) yang kuat dapat memberikan perlindungan dari berbagai serangan terhadap aplikasi web dan memungkinkan pemantauan lalu lintas http. selain menggunakan waf metode reverse proxy juga terbukti dapat menambah daya perlindungan sebuah server web karena dengan metode ini membuat tidak adanya keterkaitan langsung antara client dan server utama sehingga server terhindar dari serangan."
http://jurusan.tik.pnj.ac.id/newrepositori/v2/dok/33,TMJ,"web scraping, cloud computing",rancang bangun web aplikasi menggunakan serverless architecture dan metode web scraping sebagai sumber data,"bermula dari masalah yang ditemui penulis saat ingin melakukan pengecekan nilai semester dari halaman portal mahasasiswa politeknik negeri jakarta. penulis menemukan kurang informatifnya nilai yang disajikan dalam halaman portal mahasiswa politeknik negeri jakarta, dimana di halaman portal mahasiswa tersebut hanya terdapat nilai yang hanya disajikan dalam bentuk tabel saja. pada kesempatan ini penulis akan menggunakan studi kasus dimana membuat web aplikasi untuk visualisasi nilai online mahasiswa politeknik negeri jakarta, dengan melakukan web scraping langsung dari portal mahasiwa pnj (old.pnj.ac.id/mahasiswa). web aplikasi ini menggunakan komputasi awan (serverless architecture) dimana dengan serverless architecture ini penulis dapat menjalankan sebuah kode atau fungsi tanpa harus menyediakan ataupun mengelola server. layanan aws dari amazon yang akan penulis gunakan adalah. aws lambda (fungsi / logika pemrograman), aws rds (database), aws api gateway (pintu masuk untuk mengakses fungsi atau service aws lambda). selain itu aplikasi ini juga akan mengimplementasi web security di antaranya captcha untuk menangkal bot, dan juga cloud ddos protection untuk antisipasi serangan ddos. fitur-fitur yang ada di web aplikasi ini di antaranya adalah : menampilkan nilai-nilai yang sudah disusun rapih berdasarkan semesternya, visualiasi ip semester mahasiswa dalam bentuk grafik, penghitungan otomatis ipk mahasiwa, grafik data perbandingan nilai ip semester antar mahasiswa, keseluruhan mahasiswa, jurusan, prodi dan kelas, dan juga tersedianya sistem live-chat."
http://jurusan.tik.pnj.ac.id/newrepositori/v2/dok/36,TMJ,"basic analysis security engineering (base), data flooding, denial of service (dos), intrusion detection system (ids), intrusion prevention system (ips), snort.",rancang bangun ids dan ips menggunakan base snort pada serangan data flooding pada jaringan jurusan tik pnj,"saat sebuah perangkat komputer terhubung oleh suatu jaringan, perangkat komputer tersebut memiliki potensi dan rentan untuk diretas atau disusupi. dengan demikian, dibutuhkan sistem keamanan yang dapat mendeteksi, meganalisis, dan mengambil tindakan pada lalu lintas jaringan yang tidak diinginkan. maka dari itu dibuatlah sistem keamanan jaringan intrusion detection system (ids) yang mendeteksi serangan atau paket tidak diinginkan, basic analysis and security engineering (base) sebagai sistem monitoring gui, serta iptables sebagai intrusion prevention system (ips) yang mengatur tindakan pada paket-paket mencurigakan. sistem diuji menggunakan serangan tcp flooding menggunakan slowloris dan udp flooding menggunakan hping3, pengujian menunjukkan serangan tcp flooding sebanyak 500 paket membutuhkan waktu 10,77 s dengan rata-rata response time 21,54 ms, dan serangan 1000 paket membutuhkan waktu 23,06 s dengan rata-rata 23,06 ms. sedangkan pada serangan udp flooding sebanyak 500 paket membutuhkan waktu 248,54 s dengan rata-rata 5,9 ms, dan serangan 1000 paket membutuhkan waktu 499,98 s dengan rata-rata 6,3 ms. serangan 500 dan 1000 paket ini tidak mempengaruhi load time website namun mempengaruhi performa server diantaranya cpu dan memori. setelah melakukan pengujian dapat disimpulkan bahwa iptables efektif dalam melakukan blocking jaringan penyerang."
http://jurusan.tik.pnj.ac.id/newrepositori/v2/dok/37,TMJ,"algoritma hill cipher, algoritma caesar cipher, kriptografi, keamanan basis data",algoritma caesar cipher dan hill cipher untuk meningkatkan keamanan database,"database atau basis data menurut stephens dan plew dalam buku simarmata & paryudi adalah mekanisme yang digunakan untuk menyimpan informasi atau data. perkembangan teknologi saat ini membuat pengaksesan terhadap informasi semakin mudah dan memberikan pengaruh besar terhadap keamanan informasi yang menggunakan media penyimpanan. salah satu masalah dari keamanan informasi adalah kebocoran data yang dapat disebabkan oleh pihak pihak tertentu. maka dari itu diperlukan sebuah metode untuk menjaga database atau basis data tersebut agar tetap aman. dalam penelitian ini, metode yang digunakan untuk mengamankan database adalah enkripsi menggunakan algoritma caesar cipher dan hill cipher. algoritma caesar cipher mengenkripsi data dengan cara menggeser posisi plainteks sebanyak jumlah kunci dan algoritma hill cipher mengenkripsi dengan cara mengalikan hasil dari enkripsi caesar cipher dengan kunci matriks. hasil akhir dari penerapan algoritma ini diperoleh pengamanan data pada database lebih terjamin keamanannya."
http://jurusan.tik.pnj.ac.id/newrepositori/v2/dok/45,TMJ,"cyber security,ids,kemanan jaringan, snort,telegram",rancang bangun sistem alarm menggunakan snort berbasis raspberry pi dilengkapi notifikasi telegram,meningkatnya penggunaan internet perlu juga diimbangi dengan keamanan jaringan yang baik dan efisien terutama dari segi biaya. salah satu untuk mengamankan jaringan terutamanya untuk server adalah dengan menggunakan ids (intrussion detection system). snort ids biasanya hanya memberikan notifikasi melaui terminal atau web interface saja yang merupakan salah satu kelemahan yang bisa saja menyebabkan network administrator melewatkan notifikasi tersebut jika terjadinya serangan. raspberry pi adalah mini komputer dengan harga terjangkau dan mampu menjalankan beberapa aplikasi salah satunya adalah ids snort. salah satu aplikasi pengiriman pesan berbasis mobile adalah telegram dan salah satu alat untuk sadar akan adanya sesuatu peringatan bisa menggunakan alarm. sehingga dengan menggabungkan ids dengan aplikasi telegram adalah kombinasi yang tepat untuk memberikan notifikasi langsung melalui smartphone ketika berada pada luar ruangan dan serta alat untuk peringatan sesuatu menggunakan alarm memberikan peringatan kepada network administrator di dalam ruangan. pemberian alarm untuk peringatan dimaksudkan karena tidak semua network administrator yang selalu memperhatikan smartphone dan melakukan monitoring saja saat bekerja. pada penelitian ini akan dirancang sebuah alat yang menggabungkan raspberryi pi dengan alarm untuk peringatan dini adanya ancaman serta aplikasi telegram untuk pengiriman notifikasi dengan memperhatikan waktu respon deteksi dan penggunaan sumberdaya raspberry pi yang digunakan (cpu dan memory).
http://jurusan.tik.pnj.ac.id/newrepositori/v2/dok/50,TMJ,"intrusion detection system (ids), intrusion prevention system (ips), pfsense, snort.",analisis peningkatan keamanan server menggunakan snort dan pfsense pada jurusan teknik informatika dan komputer di politeknik negeri jakarta,"kendala luar yang menggangu keamanan pada sistem server jurusan teknik informatika dan komuter di politeknik negeri jakarta seperti serangan pada sistem server serangan dos attack. dalam meningkatkan segi keamanan sistem server jurusan teknik informatika dan komputer di politeknik negeri jakarta. oleh sebab itu dibutuhkan penanggulangan dari ancaman berupa penggunaan intrusion detection system (ids) mengetahui adanya serangan yang masuk berupa peringatan pada sistem jaringan komputer. serta penerapan intrusion prevention system (ips) sebagai proteksi keamanan sistem server berupa penggunaan pfsense. metode yang digunakan berupa alert atau monitoring server apabila adanya serangan yang masuk, log snort membantu system administrator mencatat segala jenis aktivitas yang mencurigakan pada server dan penggunaan firewall sebagai hardening apabila terjadi serangan yang masuk dari jaringan local, serta dapat melakukan deny akses apabila serangan mencoba akses sistem server jurusan tik-pnj. firewall pada pfsense menghalau dan memproteksi serangan yang mencoba masuk menuju server. dari hasil pengujian, snort mampu melakukan monitoring dan menyimpan log dan pfsense dapat melakukan blocking akses pada saat jaringan mencoba masuk pada sistem server serta pada serangan ping of death dan smurf attack berlangsung."
http://jurusan.tik.pnj.ac.id/newrepositori/v2/dok/51,TMJ,"security information and event management (siem), ibm qradar community edition, ancaman siber, serangan siber, server",analisis kinerja security information and event management (siem) ibm qradar community edition dalam mendeteksi ancaman dan serangan siber pada server,"sistem keamanan menjadi kebutuhan untuk mendeteksi potensi ancaman dan serangan siber pada server. kejadian yang berhubungan dengan ancaman dan serangan yang ditargetkan pada server akan menghasilkan log yang dapat dianalisis untuk selanjutnya dijadikan dasar pengambilan keputusan. security information and event management (siem) dapat memberikan informasi terhadap ancaman dan serangan kemanan pada server. ibm qradar community edition (ce) merupakan produk siem gratis dengan fitur lengkap dan konfigurasi yang sederhana. pada penelitian ini dilakukan rancang bangun, konfigurasi, dan analisis terhadap kinerja dari qradar ce. analisis dilakukan dengan mengevaluasi output qradar ce setelah dilakukan pengujian konfigurasi flow source dan log source, simulasi incorrect log in, port scanning, password cracking, denial of service, dan eksploitasi metasploitable 3 dan pengukuran efektivitas berdasarkan identifikasi serangan sebagai offense dan deteksi log atau network activity sebagai bagian dari serangan. didapatkan, instalasi ibm qradar ce dilakukan dengan file ova yang disediakan ibm. untuk mendapatkan network dan event activity masing-masing harus dikonfigurasi flow dan log source. event dikenal setelah diterima beberapa log. tingkat efektivitas identifikasi serangan sebesar 20% dan deteksi serangan sebesar 100% dengan log source linux os dan windows event log. tidak terdapat perbedaan antara os dengan basis yang sama (linux dan windows) dan antara versi lama dan baru."
