url,prodi,kata_kunci,judul,abstrak
http://jurusan.tik.pnj.ac.id/newrepositori/v2/dok/286,TI,"android studio, tensorflow lite, ojek onlie, syar’i, covid-19, google maps api.",rancang bangun ojek online syari berdasarkan jenis kelamin dengan fitur deteksi masker tensorflow lite,"perusahaan gojek dan grab merupakan transportasi online yang termasuk besar di indonesia. perusahaan tersebut sangat membantu serta memudahkan masyarakat indonesia untuk berpergian ke suatu tempat. dari sekian banyak masyarakat yang menggunakan jasa perusahaan tersebut, perempuan merupakan konsumen terbesar dibandingkan laki – laki. tidak sedikit pula terjadi kasus pelecehan dalam penggunaan transportasi online terhadap perempuan. hal ini terjadi dikarenakan adanya kesempatan yang ada, salah satunya penumpang yang menggunakan jasa transportasi online ini perempuan. dari permasalahan tersebut, penulis akan mengembangkan aplikasi yang sudah ada dengan menambahkan fitur driver dan penumpang akan di pertemukan berdasarkan gender yang sejenis. maka dari itu penulis memberikan nama ojek syar’i karena penumpang dipertemukan sesuai dengan gender. fitur yang ditambahkan juga seperti verifikasi masker untuk menerapkan protocol covid-19 serta user dapat memilih kendaraan sesuai jenis kendaraan (sport, motor bebek, skuter matik dll) karena tidak sedikit penumpang yang menggunakan rok ataupun gamis. metode yang digunakan untuk merancang aplikasi ini menggunakan metode waterfall. dibutuhkan anlisa requirement, design system, implementasi , verifikasi serta testing. dengan adanya aplikasi ini diharapkan dapat mengurangi pelecehan di transportasi online, mengurangi penularan covid-19 serta dapat membuat pengguna nyaman karena dapat memilih kendaraan yang diinginkan."
http://jurusan.tik.pnj.ac.id/newrepositori/v2/dok/287,TI,"digital transformasi, pelayanan administrasi penduduk, berbasis web, waterfall",rancang sistem informasi pelayanan administrasi penduduk pada kelurahan padurenan bekasi timur,"pada era digital transformasi saat ini, sudah banyak instansi pemerintahan yang menggunakan sistem informasi berbasis digital. namun, pada kelurahan padurenan masih menggunakan cara manual. hal ini dinilai menjadi kurang efektif. maka dari itu perlu dibuatkan sistem informasi berbasis web dengan metode pengembangan sistem waterfall. yang dapat digunakan untuk membantu proses pelayanan administrasi penduduk."
http://jurusan.tik.pnj.ac.id/newrepositori/v2/dok/288,TI,"black box testing, laravel, waterfall",rancang bangun toko online berbasis web pada klinik dan petshop enzo menggunakan framework laravel,"enzo petshop and clinic adalah sebuah usaha dibidang penyedia kebutuhan serta pelayanan jasa bagi hewan peliharaan yang berlokasi di jl. tugu raya, tugu, kec. cimanggis, kota depok, jawa barat 16451. namun, bidang usaha ini masih mengalami kendala dikarenakan, proses bisnisnya masih dilakukan secara manual, sehingga apabila customer ingin melakukan pembelian barang atau penyewaan jasa, mereka harus datang atau mengantarkan hewannya ke petshop tersebut atau melalui chat whatsapp untuk mengetahui stok barang yang dijual. untuk menyelesaikan permasalahan tersebut, maka dibangunlah sistem toko online untuk petshop ini, sehingga nantinya proses bisnis yang dilakukan oleh petshop tersebut menjadi lebih efisien dan efektif, dikarenakan customer tidak perlu datang dan mengantri untuk melakukan pembelian barang atau penyewaan jasa. pembuatan website dilakukan dengan framework laravel dan menggunakan database mysql. metode yang dilakukan dalam pengembangan sistem ini menggunakan metode waterfall. pengujian dilakukan menggunakan metode black box serta user acceptance test untuk mengetahui apakah terjadi error atau bug pada sistem yang dibuat. dari pengujian black box dan uat mendapatkan hasil yang baik pada pengujian fungsionalitas sistem, menunjukan bahwa aplikasi dapat berfungsi dan digunakan dengan baik."
http://jurusan.tik.pnj.ac.id/newrepositori/v2/dok/289,TI,"android, covid-19, tanaman, wp",pengimplementasikan perhitungan metode weighted product pada android sistem pendukung keputusan tanaman hias,"tanaman merupakan jenis organisme yang dapat dibudi dayakan pada suatu ruang atau media untuk dipanen pada masa ketika sudah mencapai tahap pertumbuhan tertentu. selama masa pandemi covid-19 masyarakat diharuskan untuk tetap tinggal dirumah dan untuk menghabisakan waktu banyak dari masyarakat melakukan tanaman hias dirumah. salah satu hambatan dari tanaman hias dirumah adalah sulitnya menentukan tanaman yang cocok untuk ditanam di lingkungan rumah karena kendala ketersediaan lahan, cuaca, perawatan, lama panen, dan harga bibit. untuk itu penelitian ini akan membahas tentang sistem pendukung keputusan penentuan tanaman hias disaat pandemi covid-19 menggunakan metode wp (weighted product) berbasis android. wp merupakan metode pengambilan keputusan dengan cara perkalian untuk menghubungkan rating atribut, dimana rating setiap atribut harus dipangkatkan dulu dengan bobot atribut yang bersangkutan. adanya aplikasi sistem pendukung keputusan penentuan tanaman hias yang hasilnya akan dijadikan pendukung keputusan dalam tanaman hias dirumah."
http://jurusan.tik.pnj.ac.id/newrepositori/v2/dok/290,TI,"nfc, landing page, web, interaksi sosial, aplikasi, kartu nama digital, sosial media, qr code.",rancang bangun aplikasi “tagtos” kartu nama digital berbasis web,"kemajuan teknologi membuat digitalisasi pada aktifitas sehari-hari tak dapat dipungkiri, pada interaksi sosial ketika dihadapkan dengan lingkungan baru di butuhkan sebuah kartu nama. kartu nama adalah salah satu bentuk tanda pengenal analog jika seseorang ingin berkomunikasi lebih lanjut dan menjadi sebuah personal branding bagi seseorang. dengan kemajuan yang sangat pesat diperlukan alternatif digitalisasi kartu nama yaitu dengan menfaatkan teknologi near field communication, qr code dan website sebagai landing page kartu nama yang berisi konten kartu nama. penelitian ini bertujuan untuk rancang bangun aplikasi kartu nama digital berbasis website, siklus pengembangan perangkat lunak yang digunakan adalah waterfall dengan framework laravel. hal-hal tersebut akan mempermudah dalam pertukaran kartu nama, mengatur konten isi kartu nama, dan mempermudah dalam management kartu nama. pada hasil pengujian uat dari 10 responden menunjukan bahwa aplikasi kartu nama digitial ini dapat memenuhi kebutuhan dari sebuah kartu nama yang dibutuhkan oleh pengguna."
http://jurusan.tik.pnj.ac.id/newrepositori/v2/dok/291,TI,"oauth 2.0, openid connect, laravel, php, ory hydra, pnj, pusdatin",pembuatan sistem pusat penyedia identitas untuk politeknik negeri jakarta,"politeknik negeri jakarta (pnj) memiliki unit transformasi digital (utd) yang berfungsi untuk mengelola dan mengembangkan sistem informasi manajemen (sim) berbasis teknologi digital dalam rangka membangun sistem layanan yang lebih efektif, efisien, dan handal serta sebagai penunjang dalam pengambilan keputusan/kebijakan pimpinan. single sign on ke pusat otentikasi utama memungkinkan pengguna untuk mendapatkan akses ke sistem/aplikasi lain. sso menghindari pengguna mengingat banyak password dan juga mengurangi jumlah waktu yang dihabiskan pengguna untuk mengetik berbagai kata sandi untuk masuk ke sistem. berdasarkan kondisi di atas, maka akan dirancang sebuah sistem single sign on berbasis standar oauth 2.0 untuk memverifikasi pengguna pada aplikasi dan sistem informasi manajemen di pnj. impelementasi sistem single sign on (sso) dapat dijalankan pada aplikasi atau sim pnj berbasis web maupun perangkat mobile."
http://jurusan.tik.pnj.ac.id/newrepositori/v2/dok/292,TI,"android, smart ktm, radio frequency identification",rancang bangun aplikasi smart ktm untuk e-parking dan e-canteen berbasis android menggunakan radio frequency identification,"setiap orang yang berstatus sebagai mahasiswa pasti memiliki kartu tanda mahasiswa. ktm tersebut didapatkan dari suatu perguruan tinggi untuk tanda bukti bahwa mahasiswa tersebut terdaftar sebagai mahasiswa pada perguruan tinggi tersebut. seiring dengan perkembangan teknologi yang semakin pesat, banyak ditemukan dan dikembangkan suatu teknologi baru. salah satu teknologi yang saat ini banyak digunakan ialah radio frequency identification (rfid). radio frequency identification (rfid). rfid merupakan teknologi contactless yang digunakan untuk membaca data pada suatu kartu. rfid juga bisa diimplementasikan pada kartu tanda mahasiswa. ktm tersebut nantinya bisa digunakan oleh mahasiswa sebagai akses untuk parkir mahasiswa dan alat pembayaran yang berisi sejumlah saldo yang bisa diisi ulang untuk transaksi pembelian makan dan minum di kantin. diharapkan dengan teknologi rfid yang digunakan pada ktm dapat mempermudah mahasiswa mengakses fasilitas kampus hanya dengan satu kartu. aplikasi smart ktm berbasis android diharapkan dapat membantu mahasiswa untuk mengatur penggunaan dari smart ktm untuk e-parking dan e-canteen."
http://jurusan.tik.pnj.ac.id/newrepositori/v2/dok/293,TI,"cuti, pengajuan, website, php",rancang bangun sistem pengajuan cuti dan izin berbasis website studi kasus unit kepegawaian pt. xyz,"kebutuhan teknologi semakin maju meliputi hampir semua aspek yang ada dan salah satu nya didalam perusahaan, tidak terkecuali di bagian kepegawaian. terdapat banyak proses didalam bagian kepegawaian seperti izin pegawai, pengajuan cuti yang masih dilakukan manual dan harus berinteraksi secara tatap muka langsung dengan atasan dan hrd dan juga pengajuan izin seperti lembur, izin dinas. kegiatan ini masih dilakukan secara manual dan tidak efektif karena terlalu banyak pihak terkait terlibat untuk mendapatkan izin. oleh karena itu sangat dibutuhkan suatu sistem agar memperingkas proses tersebut dan membuat proses menjadi efektif. pengembangan sistem menggunakan waterfall yang meliputi survey sistem, analisis sistem, desain sistem, pembuatan sistem, implementasi sistem, dan perawatan sistem yang diharapkan bisa mempermudah pegawai dalam melakukan pengajuan cuti, pengajuan lembur dan pengajuan izin dinas. aplikasi ini berbasis website dan pembuatan program aplikasi ini menggunakan metode waterfal serta menggunakan bahasa pemrograman seperti php, javascript dan css."
http://jurusan.tik.pnj.ac.id/newrepositori/v2/dok/295,TI,"face recognition, sistem absensi karyawan, web, opencv, webcam, python",sistem absensi dengan face recognition menggunakan opencv berbasis web,"sistem biometrik face recognition merupakan salah satu cara identifikasi. sistem ini melakukan pengenalan identitas seseorang berdasarkan wajah seseorang yang diambil oleh kamera. face recognition merupakan salah satu teknologi biometrik yang sudah banyak digunakan didalam segala bidang, mulai dari security hingga absensi. dalam applikasinya face recognition menggunakan sebuah kamera untuk menangkap wajah seseorang kemudian membandingkan wajah yang sebelumnya telah tersimpan di dalam database tertentu. absensi adalah suatu kegiatan yang dilakukan karyawan untuk membuktikan dirinya hadir. karyawan melakukan tanda tangan pada lembar kehadiran yang telah dipersiapkan. hal ini dapat menimbulkan masalah, yaitu memungkinkan terjadinya kecurangan pada saat pengisian absensi. oleh karena itu penulis berniat akan mengembangkan sistem absensi dengan face recognition. sistem ini mewajibkan karyawan untuk berada di depan face cam untuk melakukan absensi menggunakan face recognition. dengan adanya sistem ini diharapkan dapat mengurangi terjadinya kecurangan pada saat absensi."
http://jurusan.tik.pnj.ac.id/newrepositori/v2/dok/296,TI,"aplikasi, bank sampah, laravel, web",rancang bangun aplikasi bank sampah berbasis web pada desa sukasari,"bank sampah di desa sukasari merupakan kelompok lingkungan hidup yang bergerak dalam bidang kesehatan lingkungan. kegiatan ini dilakukan oleh perwakilan masyarakat, dan nasabahnya masyarakat lingkungan desa setempat. sistem bank sampah desa sukasari dilakukan setiap 1 bulan sekali di kantor desa sukasari untuk dilakukan penimbangan sampah yang sudah dipilah berdasarkan sampa non-organik, dengan jenis seperti: plastik, kertas, kaca, dan metal. tujuan dari penyusunan skripsi ini adalah menghasilkan aplikasi pengolahan data bank sampah berbasis web yang dapat mengolah data sampah dan riwayat transaksi, dan dapat memberikan informasi untuk petugas maupun warga sebagai nasabah bank sampah. pembuatan sistem aplikasi bank sampah menggunakan metode waterfall. tahap metode yaitu, tahap analisis, design, implementasi atau pembuatan kode program, dan pengujian. analisis kebutuhan dilakukan untuk mengetahui kebutuhan pengguna dan sistem secara kategoris. proses identifikasi kebutuhan pengguna dilakukan dengan cara wawancara. sedangkan, proses identifikasi kebutuhan sistem dilakukan dengan cara identifikasi kebutuhan fungsional dan non fungsional. berdasarkan hasil pengujian yang dilakukan menggunakan beberapa skenario yaitu pengujian alpha black box, mendapatkan hasil yang baik dengan skor 100% yang berarti semua fitur dan fungsi dapat berjalan dengan baik. pengujian kebergunaan sistem dilakukan dengan metode sus memperoleh hasil skor 85 atau grade a, yang berarti tingkat kegunaan sistem sangat baik."
http://jurusan.tik.pnj.ac.id/newrepositori/v2/dok/297,TI,"sistem pakar, anemia, ibu hamil, forward chaining, laravel",rancang bangun sistem pakar diagnosis penyakit anemia pada ibu hamil dengan metode forward chaining berbasis website,"anemia merupakan suatu kondisi tubuh dimana sel-sel darah merah (eritrosit) atau hemoglobin (hb) yang sehat dalam darah berada di bawah nilai normal. anemia pada ibu hamil sering terkait dengan kematian dan gangguan pada ibu dan bayi, termasuk risiko keguguran, lahir mati, prematuritas, dan berat bayi rendah dari batas minimal berat bayi normal. banyak faktor yang diduga dengan kejadian anemia pada ibu hamil salah satunya dikarenakan kurangnya pengetahuan ibu hamil mengenai anemia. untuk mendorong dan memanfaatkan teknologi informasi dan membantu dalam bidang kesehatan. sehingga dibuatlah sistem pakar diagnosis ini agar mempermudah mengidentifikasi penyakit anemia terhadap ibu hamil secara dini. sistem ini menggunakan metode forward chaining. forward chaining menggunakan rules yang sesuai dengan nilai dasar keputusan yang cocok dengan fakta yang diketahui untuk memperoleh fakta baru dan melanjutkan proses hingga tujuan yang dicari tercapai. sistem ini berbasis website dengan framework laravel agar pengguna dapat menggunakannya lebih mudah dan fleksibel. pengguna cukup mengisi pertanyaan-pertanyaan yang berisi gejala-gejala terhadap pemyakit anemia yang dialami oleh pengguna."
http://jurusan.tik.pnj.ac.id/newrepositori/v2/dok/298,TI,"chatbot, nlp, website, levenshtein distance, laravel",rancang bangun chatbot pada website politeknik negeri jakarta (pnj.ac.id),"website politeknik negeri jakarta yaitu www.pnj.ac.id memiliki berbagai informasi seperti tentang kampus, akademik, penerimaan mahasiswa, layanan, kontak dan lain lain. hal ini membuat website sangat penting dalam memenuhi kebutuhan informasi dan layanan yang menunjang kegiatan kampus. akan tetapi, terkadang informasi pada website pnj sulit digapai atau tidak tersampaikan kepada pengguna akhir, terlebih website pnj tidak menyediakan fitur faq dan live chat. sehingga, dapat menimbulkan kebingungan yang menyebabkan ketidakpuasan pengguna. ditambah lagi, pengunjung yang menghubungi kontak yang tersedia membuat humas pnj mendapat pertanyaan berulang yang menyebabkan kurang efisien dalam menanganinya. agar pengunjung website dapat mengajukan pertanyaan kapan saja, serta membantu humas pnj agar tidak perlu menjawab pertanyaan yang sama dibuatlah fitur chatbot. jenis chatbot yang dibuat adalah rule based chatbot yang memilih respon sistem berdasarkan data pada database. pencocokan input pertanyaan dengan database dilakukan menggunakan algoritma levenshtein distance. sistem dibuat menggunakan framework php laravel. hasil dari penelitian ini adalah chatbot pada website yang dapat merespon pertanyaan dengan akurasi 76% dan response time dibawah 0,2 detik, serta backend admin untuk melakukan perubahan data pada chatbot."
http://jurusan.tik.pnj.ac.id/newrepositori/v2/dok/299,TI,aplikasi e-kontraktor,pembuatan aplikasi e-kontraktor untuk menghubungkan kontraktor dan klien berbasis android,"aplikasi e-kontraktor adalah aplikasi yang mempertemukan pelaku usaha konstruksi/kontraktor dan customer dengan lebih mudah dan aplikasi ini diciptakan berbasis android untuk menggunakannya. alasan saya menciptakan aplikasi ini adalah untuk mempermudah kedua belah pihak yaitu kontraktor dan customer saling bertemu, aplikasi ini juga membantu user(customer) untuk menjangkau secara luas kontraktor yang ada tersebar diwilayah sekitarnya , dengan aplikasi ini memudahkan cara user untuk memilih kontraktor yang sesuai dengan kriterianya.sebab di aplikasi ini saya menyediakan beberapa tools yang membuat perusahaan itu bisa lebih dipercaya oleh customer, dengan cara user kontraktor mencantumkan portofolio perusahaan dan hasil karya-karya bangunan atau proyek yang sudah pernah dikerjakan maka customer bisa menilai sebuah perusahaan tersebut sesuai atau tidaknya dari portofolio dan hasil karya yang dicantumkan oleh user kontraktor. aplikasi ini menyediakan fitur untuk customer(klien) membuka lelang proyek dimana nanti ada satu tampilan yang berisi lelang-lelang proyek bangunan . yang bertujuan untuk memilih dan mendapatkan kontraktor yang sesuai dengan proyek customer dengan adanya fitur lelang juga membuat keuntungan di kedua belah pihak seperti customer yang bisa memilah perusahaan kontraktor yang mempunyai perkiraan dana pembangunan yang sesuai dari customer begitu juga dari kontraktor yang mudah mencari lelang proyek dikarenakan sudah disiapkannya fitur lelang. dengan aplikasi ini saya berharap bisa memecahkan masalah yang ada yaitu ketika sulitnya mencari kontraktor yang sesuai kriteria dan juga sulitnya kontraktor mencari proyek yang ada. dengan adanya e-kontraktor saya berharap bisa menghubungkan pihak-pihak yang terkait bisa bertemu dan melakukan kesepakatan melalui aplikasi ini . tujuan besar dari diciptakannya aplikasi ini ingin merubah cara konvesional yang rumit berubah dengan mudah lewat sebuah aplikasi e-kontraktor."
http://jurusan.tik.pnj.ac.id/newrepositori/v2/dok/300,TI,"sistem informasi geografis, dijkstra, kebakaran",rancang bangun sistem informasi geografis untuk penentuan rute terdekat lokasi kebakaran di dki jakarta menggunakan algoritma dijkstra,"peristiwa kebakaran merupakan bencana yang tidak bisa di prediksi sebelumnya. akan tetapi peristiwa kebakaran biasanya disebabkan oleh hubungan arus pendek listrik, puntung rokok yang dibuang disembarang tempat, dll. peristiwa kebakaran dapat menyebabkan kerugian yang cukup tinggi bagi korbannya. sehingga dalam penanganannya harus tepat dan cepat. ketika kebakaran terjadi, pihak yang pertama kali dihubungi tentulah dinas pemadam kebakaran. untuk itu dinas pemadam kebakaran harus mencari jalur terdekat untuk sampai ke tempat tujuan. dengan menggunakan metode dijkstra dapat menentukan jalur atau rute terdekat pada suatu graf. dengan dukungan sistem informasi geografis kebakaran ini menggunakan framework laravel, masyarakat dapat mengetahui titik lokasi kebakaran di dki jakarta."
http://jurusan.tik.pnj.ac.id/newrepositori/v2/dok/303,TI,"reminder, service kendaraan, whatsapp gateway, website.",rancang bangun aplikasi reminder service kendaraan dengan pemanfaatan teknologi whatsapp gateway berbasis website,"penelitian ini bertujuan sebagai media untuk memudahkan pengguna kendaraan dalam mengingat waktu untuk melakukan service pada kendaraannya. masalah yang sering terjadi terhadap pengguna kendaraan adalah tidak ingat kapan waktu untuk melakukan service pada kendaraannya sehingga menyebabkan terjadinya kerusakan pada kendaraan tersebut. untuk mengantisipasi kejadian tersebut dibutuhkan sebuah sistem dimana pengguna kendaraan bisa mendapatkan informasi kapan kendaraannya sudah waktunya untuk melakukan service lewat sebuah media yang mudah diakses. dalam hal ini perancangan aplikasi menggunakan whatsapp gateway sebagai metode. hasil dari penelitian ini yaitu aplikasi berbasis website untuk mengirim notifikasi berupa pesan whatsapp kepada pengguna mobil yang berisi informasi waktu kapan kendaraannya harus melakukan service. dengan adanya aplikasi reminder service ini diharapkan dapat memudahkan pengguna kendaraan dalam mengingat kapan waktu untuk melakukan service kendaraannya, dan dapat mengantisipasi terjadinya kerusakan karena telat melakukan service."
http://jurusan.tik.pnj.ac.id/newrepositori/v2/dok/304,TI,"shuffle method, abcd play, aplikasi, anak-anak, waterfall.",rancang bangun aplikasi game abcd play dengan shuffle method berbasis android,"abcd play merupakan aplikasi game pembelajaran untuk anak usia dini yang berisikan konten-konten pendidikan seperti belajar membaca dan menyusun kata, berhitung, menggambar, mengenal nama-nama hewan, tata cara sholat, dan quiz latihan mini play. penelitian ini dilakukan berdasarkan data penelitian di masa pandemi covid-19, sebagian besar anak-anak melakukan aktifitasnya didalam rumah. para orang tua kesulitan dalam membimbing anak-anak untuk belajar membaca, berhitung, dan membuat kreatifitas gambar. aplikasi ini menggunakan shuffle method yang merupakan metode untuk mengacak objek seperti mengacak gambar, pertanyaan dan jawaban pada aplikasi ini. untuk metode penelitian, menggunakan metode pengembangan sdlc waterfall. dari hasil pengujian aplikasi ini, didapat tingkat keberhasilan pengujian alpha testing sebesar 94.4%, untuk penilaian pengguna terhadap shuffle method yang digunakan sebesar 86.7%, dan tingkat kepuasan pengguna sebesar 93.3%. berdasarkan hasil pengujian dan penilaian diatas, aplikasi ini dapat membantu untuk mengajarkan anak membaca dan menyusun kata, berhitung, menggambar, mengenal nama-nama hewan, tata cara sholat, dan mengerjakan quiz latihan."
http://jurusan.tik.pnj.ac.id/newrepositori/v2/dok/305,TI,"donor darah, website, android, sdlc",implementasi pada aplikasi layanan donor darah berbasis web mengunakan framework laravel,"donor darah merupakan kegiatan berbagi darah secara sukarela kepada orang yang sedang membutuhkan. pada tahun 2018 indonesia kekurangan satu juta pasokan kantong darah dan belum memenuhi standar world health organization (who) standar kantong darah untuk indonesia sekitar 5,2 juta kantong darah dihitung dari 2% dari penduduk indonesia yang berkisar 255 juta jiwa. ketika stok darah di rumah sakit dan pmi kosong banyak keluarga yang mencari pendonor secara mendadak dikarenakan darah yang dicari harus sesuai dengan kebutuhan. dari permasalahan diatas penulis melakukan penelitian yang bertujuan agar memudahkan keluarga mencari pendonor melalui website dan aplikasi android. metode yang digunakan yaitu metode sdlc dalam lima tahap yaitu analisis, perancangan, implementasi, pengujian dan pemeliharaan agar menghasilkan aplikasi yang sesuai dengan apa yang diharapkan."
http://jurusan.tik.pnj.ac.id/newrepositori/v2/dok/306,TI,"web, sistem pakar, forward chaining, jurusan, kecerdasan majemuk",rancang bangun website sistem pakar menggunakan metode forward chaining untuk merekomendasikan jurusan,"sistem pakar rekomendasi jurusan menggunakan metode forward chaining adalah sistem berbasis website yang bertujuan untuk memberikan referensi tentang jurusan yang ada di smkn 1 cibinong berdasarkan minat calon siswa. sebagai penentuan jurusan, sistem ini menggunakan beberapa teori kecerdasan majemuk yang dikemukakan oleh horward gardner. metode pengembangan sistem yang digunakan yaitu waterfall. algoritma yang digunakan yaitu forward chaining. sistem dibangun dengan bahasa pemograman php serta mysql sebagai bahasa pemrograman database. sistem ini akan menirukan keahlian dari pakar (psikolog). pengujian fungsional sistem menggunakan teknik black-box testing, dengan pengujian alfa. berdasarkan hasil pengujian, fungsional sistem berjalan sesuai dengan requirement yang telah didefinisikan dengan hasil pengujian alpha 100%. hasil akhir dari penelitian ini didapatkan bahwa website sistem pakar ini dengan metode forward chaining mampu memberikan referensi untuk memilih jurusan di smkn 1 cibinong kepada calon siswa."
http://jurusan.tik.pnj.ac.id/newrepositori/v2/dok/307,TI,"blackbox testing, laravel, mysql, penilaian kinerja karyawan, presensi karyawan, profile matching, sistem pendukung keputusan, waterfall",rancang bangun sistem presensi dan penilaian kinerja karyawan dengan metode profile matching berbasis website,"presensi dan penilaian kinerja terhadap karyawan dalam sebuah perusahaan mempunyai peran penting dikarenakan dapat digunakan sebagai bahan pertimbangan para direksi untuk melakukan peninjauan ulang terhadap karyawan tersebut, tidak terkecuali pt cakra jasa pasific. penilaian kinerja pt cakra jasa pasific masih dilakukan dengan cara konvensional yaitu dengan cara mengisi pada lembar penilaian, sehingga penilaian yang dihasilkan bersifat subjektif dan kurang transparan. presensi merupakan salah satu kriteria yang digunakan untuk melakukan penilaian kinerja karyawan di pt cakra jasa pasific, namun presensi di pt cakra jasa pasific masih dilakukan dengan cara manual yaitu mengisi lembar presensi. oleh karena itu dibutuhkan sebuah sistem untuk melakukan penilaian kinerja karyawan yang didalamnya terdapat fitur presensi untuk mengurangi subjektifitas dalam penilaian dan mengubah metode presensi agar tidak dilakukan secara manual. metode yang digunakan sebagai sistem pendukung keputusan adalah profile matching dan metode pengembangan sistem menggunakan waterfall. sistem ini dibangun menggunakan framework laravel dan menggunakan mysql sebagai database. hasil presentase pengujian sistem sebesar 100% menggunakan blackbox testing dan hasil pengujian metode profile matching dalam sistem berjalan dengan baik dan akurat dengan nilai presisi 100%."
